10:21:56.698731 ARP, Request who-has 192.168.43.200 tell 192.168.43.253, length 28
10:21:56.706881 ARP, Reply 192.168.43.200 is-at 96:4e:01:b9:7a:b0, length 28
10:22:16.193544 ARP, Request who-has 192.168.43.10 tell 192.168.43.253, length 28
10:22:17.210757 ARP, Request who-has 192.168.43.10 tell 192.168.43.253, length 28
10:22:18.234662 ARP, Request who-has 192.168.43.10 tell 192.168.43.253, length 28
10:22:19.259012 ARP, Request who-has 192.168.43.10 tell 192.168.43.253, length 28
10:22:20.282735 ARP, Request who-has 192.168.43.10 tell 192.168.43.253, length 28
10:22:21.306744 ARP, Request who-has 192.168.43.10 tell 192.168.43.253, length 28
10:22:22.330887 ARP, Request who-has 192.168.43.10 tell 192.168.43.253, length 28
10:22:23.354646 ARP, Request who-has 192.168.43.10 tell 192.168.43.253, length 28
10:22:24.378738 ARP, Request who-has 192.168.43.10 tell 192.168.43.253, length 28
10:22:25.402847 ARP, Request who-has 192.168.43.10 tell 192.168.43.253, length 28
10:22:26.430719 ARP, Request who-has 192.168.43.10 tell 192.168.43.253, length 28
10:22:27.450737 ARP, Request who-has 192.168.43.10 tell 192.168.43.253, length 28
10:22:28.474895 ARP, Request who-has 192.168.43.10 tell 192.168.43.253, length 28
10:22:29.210729 ARP, Request who-has 192.168.43.144 tell 192.168.43.253, length 28
10:22:29.215919 ARP, Reply 192.168.43.144 is-at 9e:73:5f:4e:0f:5d, length 28
10:22:29.498741 ARP, Request who-has 192.168.43.10 tell 192.168.43.253, length 28
10:22:30.522735 ARP, Request who-has 192.168.43.10 tell 192.168.43.253, length 28
10:22:31.546882 ARP, Request who-has 192.168.43.10 tell 192.168.43.253, length 28
10:22:32.570730 ARP, Request who-has 192.168.43.10 tell 192.168.43.253, length 28
10:22:33.594743 ARP, Request who-has 192.168.43.10 tell 192.168.43.253, length 28
10:22:34.618777 ARP, Request who-has 192.168.43.10 tell 192.168.43.253, length 28
10:22:35.642738 ARP, Request who-has 192.168.43.10 tell 192.168.43.253, length 28
10:22:36.666741 ARP, Request who-has 192.168.43.10 tell 192.168.43.253, length 28
10:22:37.690849 ARP, Request who-has 192.168.43.10 tell 192.168.43.253, length 28
10:22:38.462667 ARP, Request who-has 192.168.43.253 tell 192.168.43.144, length 28
10:22:38.462713 ARP, Reply 192.168.43.253 is-at 7c:67:a2:ee:62:d1, length 28
10:22:38.718679 ARP, Request who-has 192.168.43.10 tell 192.168.43.253, length 28
10:22:39.738736 ARP, Request who-has 192.168.43.10 tell 192.168.43.253, length 28
10:22:40.762874 ARP, Request who-has 192.168.43.10 tell 192.168.43.253, length 28
10:22:41.786676 ARP, Request who-has 192.168.43.10 tell 192.168.43.253, length 28
10:22:42.810734 ARP, Request who-has 192.168.43.10 tell 192.168.43.253, length 28
10:22:46.040678 ARP, Request who-has 192.168.43.253 tell 192.168.43.200, length 28
10:22:46.040712 ARP, Reply 192.168.43.253 is-at 7c:67:a2:ee:62:d1, length 28
10:22:46.450186 ARP, Request who-has 192.168.43.253 tell 192.168.43.200, length 28
10:22:46.450222 ARP, Reply 192.168.43.253 is-at 7c:67:a2:ee:62:d1, length 28
10:23:43.591404 ARP, Request who-has 192.168.43.253 tell 192.168.43.144, length 28
10:23:43.591438 ARP, Reply 192.168.43.253 is-at 7c:67:a2:ee:62:d1, length 28
10:28:43.629121 ARP, Request who-has 192.168.43.253 tell 192.168.43.144, length 28
10:28:43.629157 ARP, Reply 192.168.43.253 is-at 7c:67:a2:ee:62:d1, length 28
10:32:51.802693 ARP, Request who-has 192.168.43.144 tell 192.168.43.253, length 28
10:32:51.809591 ARP, Reply 192.168.43.144 is-at 9e:73:5f:4e:0f:5d, length 28
10:33:01.066006 ARP, Request who-has 192.168.43.253 tell 192.168.43.144, length 28
10:33:01.066041 ARP, Reply 192.168.43.253 is-at 7c:67:a2:ee:62:d1, length 28
10:33:43.665321 ARP, Request who-has 192.168.43.253 tell 192.168.43.144, length 28
10:33:43.665356 ARP, Reply 192.168.43.253 is-at 7c:67:a2:ee:62:d1, length 28
10:35:27.090174 ARP, Request who-has 192.168.43.253 tell 192.168.43.144, length 28
10:35:27.090209 ARP, Reply 192.168.43.253 is-at 7c:67:a2:ee:62:d1, length 28
10:35:49.004221 ARP, Request who-has 192.168.43.253 tell 192.168.43.144, length 28
10:35:49.004256 ARP, Reply 192.168.43.2